{
  "schema_version": 1,
  "protocol": "docs/verification-protocol.md",
  "updated": "2026-10-18",
  "nodes": [
    {"id": "rvt", "format": "Autodesk Revit project/family (OLE/CFB container)", "specification": "none — undocumented; every reader is clean-room"},
    {"id": "dwg", "format": "AutoCAD DWG", "specification": "Open Design Alliance published specification (v5.4.1)"},
    {"id": "dxf", "format": "AutoCAD DXF", "specification": "Autodesk published DXF reference"},
    {"id": "ifc", "format": "IFC4 / IFC2x3 STEP Part 21", "specification": "buildingSMART ISO 16739"},
    {"id": "gltf", "format": "glTF 2.0", "specification": "Khronos glTF 2.0"},
    {"id": "e57", "format": "ASTM E57 point cloud", "specification": "ASTM E2807"},
    {"id": "step", "format": "STEP AP203/AP214/AP242 (ISO 10303-21)", "specification": "ISO 10303 published"},
    {"id": "iges", "format": "IGES 5.x", "specification": "IGES 5.3 published (ANSI)"},
    {"id": "dgn", "format": "Bentley MicroStation DGN (V7/V8)", "specification": "V7 documented by dgnlib; V8 undocumented"},
    {"id": "nwd", "format": "Autodesk Navisworks NWD/NWC/NWF", "specification": "none — undocumented; no open reader exists"},
    {"id": "las", "format": "ASPRS LAS/LAZ point cloud", "specification": "ASPRS LAS 1.4 published"}
  ],
  "witnesses": [
    {"id": "rvt-rs", "kind": "reader", "node": "rvt", "repo": "DrunkOnJava/rvt-rs", "license": "Apache-2.0", "language": "Rust", "status": "adopted", "covers": ["entity_counts", "relations", "storeys"], "notes": "the decoder under test; also writes ifc/gltf/svg. Reproduced on both magnetar Core Interior edges: `entity_counts` from its own emitted STEP constructor histogram, `relations.IFCRELFILLSELEMENT` through the void/fill chain, `storeys.IFCBUILDINGSTOREY` with the elevation unit-normalized to feet"},
    {"id": "dwg-rs", "kind": "reader", "node": "dwg", "repo": "DrunkOnJava/dwg-rs", "license": "Apache-2.0", "language": "Rust", "status": "adopted", "covers": ["entity_counts"], "notes": "sibling clean-room reader; 20.1% measured real-file entity coverage (R2018 sample 44.2%) — not yet a reliable witness for Revit exports; must parse 2D plan-view exports (LINE/LWPOLYLINE/ARC/CIRCLE/TEXT/MTEXT/INSERT/HATCH + LAYER/LTYPE/BLOCK) before the DWG edge is gated. It has produced no observation yet — the rvt-to-dwg edge is `pending` and no DWG artifact exists — so its `covers` is the surface it would claim on that edge, not a reproduced agreement; `layer_topology`, `linework`, `bounding_boxes`, `xdata_fields` and `text_content` join only when the plan-view export lands"},
    {"id": "autodesk-revit-exporter", "kind": "author", "node": "rvt", "repo": null, "license": "proprietary (licensed seat)", "language": null, "status": "adopted", "notes": "produces the canonical exports that create edges; only needed once per artifact. Carries no `covers`: the §9.4 coverage declaration is a claim about what a witness *reads*, and an authoring witness never emits an observation to compare — its output is the artifact itself, hashed in `artifacts` and bound by an `edges` entry. `covers` is therefore reader-only by rule (tests/witness_registry.rs)"},
    {"id": "ifcopenshell", "kind": "reader", "node": "ifc", "repo": "IfcOpenShell/IfcOpenShell", "license": "LGPL-3.0", "language": "C++/Python", "status": "adopted", "covers": ["entity_counts", "relations", "storeys"], "notes": "runs as a separate process in CI; no linking, no copyleft contamination of the Rust workspace. Reproduced on both magnetar Core Interior edges via `by_type`, attribute access and `ifcopenshell.util.unit`. CI runs the exact version in tools/ci/requirements-ifc.txt, 0.9.0.post1 since #773 (2026-10-18): it replays both edges' observations unchanged, and every Measure scorer gives the output 0.8.5 gives on the same commit", "checked": "2026-10-18"},
    {"id": "libredwg", "kind": "reader", "node": "dwg", "repo": "LibreDWG/libredwg", "license": "GPL-3.0", "language": "C", "status": "candidate", "priority": "high", "notes": "~99% read coverage through R2018; 0.14 (2026-06-27) adds experimental R2010–R2018 write with CRC errors; usable as a CI process witness, never linked", "checked": "2026-08-30"},
    {"id": "acadsharp", "kind": "reader", "node": "dwg", "repo": "DomCR/ACadSharp", "license": "MIT", "language": "C#", "status": "candidate", "priority": "high", "notes": "v3.7.1 (2026-08-18); ACIS payload reading for 3DSOLID/REGION/BODY since v3.6.51 (2026-07-29, PR #1139), MESH still unimplemented — the 3D-solid edge candidate; already consulted comments-only for the LZ77 offset ambiguity (dwg-rs CLEANROOM.md)", "checked": "2026-08-30"},
    {"id": "ezdwg", "kind": "reader", "node": "dwg", "repo": "monozukuri-ai/ezdwg", "license": "MIT", "language": "Rust/Python", "status": "candidate", "priority": "medium", "checked": "2026-08-30", "notes": "Rust core with a Python API, R13–R2018, pushed 2026-08-23; independent implementation (not a LibreDWG binding)"},
    {"id": "ezdxf", "kind": "reader", "node": "dxf", "repo": "mozman/ezdxf", "license": "MIT", "language": "Python", "status": "candidate", "priority": "high", "notes": "DXF is the documented twin of DWG; Revit exports DXF too", "checked": "2026-08-30"},
    {"id": "dxf-rs", "kind": "reader", "node": "dxf", "repo": "ixmilia/dxf-rs", "license": "MIT", "language": "Rust", "status": "candidate", "priority": "medium", "checked": "2026-08-30"},
    {"id": "ifc-lite", "kind": "reader", "node": "ifc", "repo": "LTplus-AG/ifc-lite", "license": "MPL-2.0", "language": "Rust", "status": "adopted", "version": "7.1.1", "crate": "ifc-lite-core", "covers": ["entity_counts", "relations", "storeys"], "checked": "2026-08-30", "notes": "third independent IFC reading witness. Reproduced on both magnetar Core Interior edges via `EntityScanner`, `parse_entity` and `ifc_lite_core::extract_length_unit_scale`. Verified 2026-08-30 against crates.io and the GitHub API: crate `ifc-lite-core` 7.1.1 published 2026-08-27, license MPL-2.0 in both the crate metadata and the repository LICENSE — an earlier entry here recorded `MIT` and a bare `ifc-lite` repo slug; both were wrong and are corrected. Independent implementation: a hand-rolled byte-level STEP scanner (src/parser/scanner.rs) plus a nom tokenizer, no IfcOpenShell code and no binding to it — the project *verifies its geometry against* IfcOpenShell, which is validation, not lineage. Adopted as a separate CI process via tools/ci/witness-ifc-lite, its own workspace root so MPL code is never linked into the Apache-2.0 tree; pinned `ifc-lite-core = \"=7.1.1\"` per §9.6."},
    {"id": "web-ifc", "kind": "reader", "node": "ifc", "repo": "ThatOpen/engine_web-ifc", "license": "MPL-2.0", "language": "C++/WASM", "status": "candidate", "priority": "medium", "checked": "2026-08-30", "notes": "0.77 (2026-03-06); browser/WASM parser, independent of IfcOpenShell"},
    {"id": "stepcode", "kind": "reader", "node": "ifc", "repo": "stepcode/stepcode", "license": "BSD-3-Clause (NOASSERTION on GitHub)", "language": "C++", "status": "candidate", "priority": "low", "notes": "generic Part 21 parser — syntax-level witness only", "checked": "2026-08-30"},
    {"id": "gltf-rs", "kind": "reader", "node": "gltf", "repo": "gltf-rs/gltf", "license": "MIT/Apache-2.0", "language": "Rust", "status": "candidate", "priority": "medium", "notes": "witness for rvt-rs glTF output validity"},
    {"id": "e57-rs", "kind": "reader", "node": "e57", "repo": "cry-inc/e57", "license": "MIT", "language": "Rust", "status": "candidate", "priority": "low", "notes": "pure-Rust E57; point-cloud scan of rendered geometry — the external oracle of last resort", "checked": "2026-08-30"},
    {"id": "phi-ag-rvt", "kind": "reader", "node": "rvt", "repo": "phi-ag/rvt", "license": "MIT", "language": "TypeScript", "status": "candidate", "priority": "medium", "checked": "2026-08-30", "notes": "v0.2.4 (2026-04-01); stops at ElemTable, no model reader — a container/table-level witness only"},
    {"id": "reviter", "kind": "reader", "node": "rvt", "repo": "ahzs645/reviter", "license": "none declared", "language": "TypeScript", "status": "candidate", "priority": "low", "checked": "2026-08-30", "notes": "browser-side experimental geometry converter; its README states the element-instance wire format is not fully decoded; no license file — cannot be adopted until licensed"},
    {"id": "revit-extractor", "kind": "author", "node": "rvt", "repo": "chuongmep/revit-extractor", "license": "GPL-3.0", "language": "Python", "status": "candidate", "priority": "low", "checked": "2026-08-30", "notes": "not a reader — shells out to Revit's RevitExtractor.exe, so it needs a licensed seat; an authoring witness at best"},
    {"id": "oda-bimrv", "kind": "reader", "node": "rvt", "repo": null, "license": "commercial (ODA)", "language": "C++", "status": "candidate", "priority": "low", "notes": "only commercial full RVT reader; certified read range per public FAQ 2011–2020, newer on roadmap; valid witness only if licensed, never linked"},
    {"id": "jdwgparser", "kind": "reader", "node": "dwg", "repo": "ebandal/jDwgParser", "license": "GPL-3.0", "language": "Java", "status": "candidate", "priority": "high", "checked": "2026-08-30", "notes": "Korean-community reader claiming 100% entity-type coverage and a 92% sample pass rate through R2018 (claims unverified here); last pushed 2026-05-21; GPL → separate-process witness only; third independent DWG reader for the plan-view edge"},
    {"id": "uncad", "kind": "reader", "node": "dwg", "repo": null, "license": "GPL-3.0 (inherits LibreDWG)", "language": "Rust", "lineage": "libredwg", "status": "candidate", "priority": "low", "notes": "Rust FFI over LibreDWG — NOT independent of libredwg; counts as the same witness under the independence rule"},